{
  "$schema": "../schema/catalog-v2.schema.json",
  "schema_version": "2.0.0",
  "updated_at": "2026-08-11T12:49:48Z",
  "collection": {
    "id": "awesome-minimax-h3-prompts",
    "repo_url": "https://github.com/opensource-works/awesome-minimax-h3-prompts",
    "model_scope": [
      {
        "family": "MiniMax",
        "version": "H3",
        "aliases": [
          "MiniMax H3",
          "MiniMax-H3",
          "#MiniMaxH3",
          "Hailuo H3",
          "Hailuo 3",
          "Hailuo 3.0",
          "Hailuo 03",
          "海螺 H3"
        ],
        "released_on": "2026-07-31",
        "public_demo_from": "2026-07-29",
        "evidence_ids": [
          "ev_release_minimax_h3"
        ]
      }
    ],
    "historical_window": {
      "from": "2026-07-29",
      "through": "2026-08-11",
      "observed_through_exclusive": "2026-08-11T12:30:00Z"
    },
    "query_matrix_version": "2026-08-11"
  },
  "discovery_runs": {
    "run_legacy_urls_import_20260811": {
      "id": "run_legacy_urls_import_20260811",
      "started_at": "2026-08-11T00:00:00Z",
      "ended_at": "2026-08-11T00:00:00Z",
      "platform": "x",
      "query_matrix_version": "legacy-urls.txt",
      "query_ids": [
        "legacy.urls.txt"
      ],
      "status": "complete",
      "result_count": 35,
      "log_url": null,
      "window_kind": "historical",
      "window": {
        "kind": "historical",
        "from": "2026-07-29T00:00:00Z",
        "through_exclusive": "2026-08-11T12:30:00Z"
      },
      "run_observed_at": "2026-08-11T00:00:00Z",
      "filtered_outside_window": 0,
      "missing_timestamp": 0
    },
    "run_historical_backfill_x_20260811": {
      "id": "run_historical_backfill_x_20260811",
      "started_at": "2026-08-11T00:00:00Z",
      "ended_at": "2026-08-11T00:00:00Z",
      "platform": "x",
      "query_matrix_version": "historical-research-2026-08-11",
      "query_ids": [
        "backfill.minimax_h3_x_missing"
      ],
      "status": "partial",
      "result_count": 22,
      "log_url": "data/backfill-2026-08-11.json",
      "limitations": [
        "An initial multilingual Seedance query run produced 614 unique video status IDs, but the raw result set was not persisted before the upstream search endpoint began returning HTTP 404. The 614 IDs are therefore not present in this file and must not be represented as a retained exhaustive inventory."
      ],
      "window_kind": "historical",
      "window": {
        "kind": "historical",
        "from": "2026-07-29T00:00:00Z",
        "through_exclusive": "2026-08-11T12:30:00Z"
      },
      "run_observed_at": "2026-08-11T00:00:00Z",
      "filtered_outside_window": 0,
      "missing_timestamp": 0
    },
    "run_historical_backfill_reddit_20260811": {
      "id": "run_historical_backfill_reddit_20260811",
      "started_at": "2026-08-11T00:00:00Z",
      "ended_at": "2026-08-11T00:00:00Z",
      "platform": "reddit",
      "query_matrix_version": "historical-research-2026-08-11",
      "query_ids": [
        "backfill.minimax_h3_reddit_candidates",
        "backfill.reference-only"
      ],
      "status": "partial",
      "result_count": 22,
      "log_url": "data/backfill-2026-08-11.json",
      "limitations": [
        "Public Reddit JSON returned HTTP 403 in this environment. Discovery used web-indexed public post pages; coverage is not exhaustive."
      ],
      "window_kind": "historical",
      "window": {
        "kind": "historical",
        "from": "2026-07-29T00:00:00Z",
        "through_exclusive": "2026-08-11T12:30:00Z"
      },
      "run_observed_at": "2026-08-11T00:00:00Z",
      "filtered_outside_window": 0,
      "missing_timestamp": 0
    }
  },
  "actors": {
    "act_repository_opensource-works": {
      "id": "act_repository_opensource-works",
      "kind": "organization",
      "platform": "repository",
      "platform_user_id": null,
      "handle": "opensource-works",
      "display_name": "opensource-works maintainers",
      "profile_url": "https://github.com/opensource-works",
      "avatar_url": null,
      "aliases": [],
      "observed_at": "2026-08-11T00:00:00Z"
    },
    "act_x_minimax_ai": {
      "id": "act_x_minimax_ai",
      "kind": "person",
      "platform": "x",
      "platform_user_id": null,
      "handle": "MiniMax_AI",
      "display_name": "MiniMax_AI",
      "profile_url": "https://x.com/MiniMax_AI",
      "avatar_url": null,
      "aliases": [],
      "observed_at": "2026-08-11T00:00:00Z"
    },
    "act_x_artificialanlys": {
      "id": "act_x_artificialanlys",
      "kind": "person",
      "platform": "x",
      "platform_user_id": null,
      "handle": "ArtificialAnlys",
      "display_name": "Artificial Analysis",
      "profile_url": "https://x.com/ArtificialAnlys",
      "avatar_url": null,
      "aliases": [],
      "observed_at": "2026-08-10T08:10:32Z"
    },
    "act_x_callmediegojr": {
      "id": "act_x_callmediegojr",
      "kind": "person",
      "platform": "x",
      "platform_user_id": null,
      "handle": "CallMeDiegoJr",
      "display_name": "Diego Jr",
      "profile_url": "https://x.com/CallMeDiegoJr",
      "avatar_url": null,
      "aliases": [],
      "observed_at": "2026-08-10T08:10:32Z"
    },
    "act_x_leonardoai": {
      "id": "act_x_leonardoai",
      "kind": "person",
      "platform": "x",
      "platform_user_id": null,
      "handle": "LeonardoAi",
      "display_name": "Leonardo.Ai",
      "profile_url": "https://x.com/LeonardoAi",
      "avatar_url": null,
      "aliases": [],
      "observed_at": "2026-08-10T08:10:32Z"
    },
    "act_x_bdsqlsz": {
      "id": "act_x_bdsqlsz",
      "kind": "person",
      "platform": "x",
      "platform_user_id": null,
      "handle": "bdsqlsz",
      "display_name": "青龍聖者",
      "profile_url": "https://x.com/bdsqlsz",
      "avatar_url": null,
      "aliases": [],
      "observed_at": "2026-08-10T08:10:32Z"
    },
    "act_x_comfyui": {
      "id": "act_x_comfyui",
      "kind": "person",
      "platform": "x",
      "platform_user_id": null,
      "handle": "ComfyUI",
      "display_name": "ComfyUI",
      "profile_url": "https://x.com/ComfyUI",
      "avatar_url": null,
      "aliases": [],
      "observed_at": "2026-08-10T08:10:32Z"
    },
    "act_x_servasyy_ai": {
      "id": "act_x_servasyy_ai",
      "kind": "person",
      "platform": "x",
      "platform_user_id": null,
      "handle": "servasyy_ai",
      "display_name": "huangserva",
      "profile_url": "https://x.com/servasyy_ai",
      "avatar_url": null,
      "aliases": [],
      "observed_at": "2026-08-10T08:10:32Z"
    },
    "act_x_umesh_ai": {
      "id": "act_x_umesh_ai",
      "kind": "person",
      "platform": "x",
      "platform_user_id": null,
      "handle": "umesh_ai",
      "display_name": "umesh_ai",
      "profile_url": "https://x.com/umesh_ai",
      "avatar_url": null,
      "aliases": [],
      "observed_at": "2026-08-11T00:00:00Z"
    },
    "act_x_gorden_sun": {
      "id": "act_x_gorden_sun",
      "kind": "person",
      "platform": "x",
      "platform_user_id": null,
      "handle": "Gorden_Sun",
      "display_name": "Gorden Sun",
      "profile_url": "https://x.com/Gorden_Sun",
      "avatar_url": null,
      "aliases": [],
      "observed_at": "2026-08-10T08:10:32Z"
    },
    "act_x_riyazmd774": {
      "id": "act_x_riyazmd774",
      "kind": "person",
      "platform": "x",
      "platform_user_id": null,
      "handle": "riyazmd774",
      "display_name": "Md Riyazuddin",
      "profile_url": "https://x.com/riyazmd774",
      "avatar_url": null,
      "aliases": [],
      "observed_at": "2026-08-10T08:10:32Z"
    },
    "act_x_ai_for_success": {
      "id": "act_x_ai_for_success",
      "kind": "person",
      "platform": "x",
      "platform_user_id": null,
      "handle": "ai_for_success",
      "display_name": "AshutoshShrivastava",
      "profile_url": "https://x.com/ai_for_success",
      "avatar_url": null,
      "aliases": [],
      "observed_at": "2026-08-10T08:10:32Z"
    },
    "act_x_kiyoshi_shin": {
      "id": "act_x_kiyoshi_shin",
      "kind": "person",
      "platform": "x",
      "platform_user_id": null,
      "handle": "kiyoshi_shin",
      "display_name": "新清士@AIコンテンツ開発者",
      "profile_url": "https://x.com/kiyoshi_shin",
      "avatar_url": null,
      "aliases": [],
      "observed_at": "2026-08-10T08:10:32Z"
    },
    "act_x_ludoviccreator": {
      "id": "act_x_ludoviccreator",
      "kind": "person",
      "platform": "x",
      "platform_user_id": null,
      "handle": "LudovicCreator",
      "display_name": "LudovicCreator",
      "profile_url": "https://x.com/LudovicCreator",
      "avatar_url": null,
      "aliases": [],
      "observed_at": "2026-08-10T08:10:32Z"
    },
    "act_x_heyshrutimishra": {
      "id": "act_x_heyshrutimishra",
      "kind": "person",
      "platform": "x",
      "platform_user_id": null,
      "handle": "heyshrutimishra",
      "display_name": "Shruti",
      "profile_url": "https://x.com/heyshrutimishra",
      "avatar_url": null,
      "aliases": [],
      "observed_at": "2026-08-10T08:10:32Z"
    },
    "act_x_ben_escrito": {
      "id": "act_x_ben_escrito",
      "kind": "person",
      "platform": "x",
      "platform_user_id": null,
      "handle": "Ben_escrito",
      "display_name": "Ben Pierron",
      "profile_url": "https://x.com/Ben_escrito",
      "avatar_url": null,
      "aliases": [],
      "observed_at": "2026-08-10T08:10:32Z"
    },
    "act_x_futurevibesai": {
      "id": "act_x_futurevibesai",
      "kind": "person",
      "platform": "x",
      "platform_user_id": null,
      "handle": "FutureVibesAi",
      "display_name": "Future Vibes AI - Educator",
      "profile_url": "https://x.com/FutureVibesAi",
      "avatar_url": null,
      "aliases": [],
      "observed_at": "2026-08-10T08:10:32Z"
    }
  },
  "sources": {
    "x:2082779062653845803": {
      "id": "x:2082779062653845803",
      "platform": "x",
      "native_id": "2082779062653845803",